{
  "skill_id": "skill_inventory",
  "name": "Odoo Inventory Expert",
  "description": "Expert-level knowledge of Odoo Inventory including products, warehouses, locations, stock moves, picking types, routes, reordering rules, lots/serial tracking, valuation, MTS/MTO, and barcode operations.",
  "version": "19.0.1",
  "domain": "Operations",
  "subdomain": "Inventory",
  "supported_odoo_versions": ["19.0"],
  "supported_modules": [
    {"name": "stock", "version": "1.1", "location": "community", "required": true},
    {"name": "stock_account", "version": "1.1", "location": "community", "required": false},
    {"name": "purchase_stock", "version": "1.2", "location": "community", "required": false},
    {"name": "sale_stock", "version": "1.1", "location": "community", "required": false},
    {"name": "stock_barcode", "version": "19.0", "location": "enterprise", "required": false},
    {"name": "stock_landed_costs", "version": "19.0", "location": "enterprise", "required": false}
  ],
  "prerequisites": [
    {"skill": "skill_base", "description": "Odoo ORM, security, and product/base models", "required": true},
    {"skill": "skill_mail", "description": "Email notifications for picking operations", "required": false}
  ],
  "dependencies": {
    "skills": [
      {"skill_id": "skill_base", "version_requirement": ">=19.0", "relationship": "depends_on"},
      {"skill_id": "skill_mail", "version_requirement": ">=19.0", "relationship": "recommended_with"}
    ],
    "odoo_modules": ["stock", "product", "uom", "mail", "purchase", "sale"],
    "external_packages": []
  },
  "compatible_agents": ["planner", "manager", "developer", "researcher", "functional", "qa", "documentation", "reviewer"],
  "capabilities": [
    {"id": "cap_products", "name": "Product & Product Variants", "description": "Configure product.template, product.product, product categories, UoM, routes, tracking modes (none, lot, serial), and inventory valuation categories.", "confidence": "high"},
    {"id": "cap_warehouses", "name": "Warehouses & Locations", "description": "Manage stock.warehouse, stock.location (internal, supplier, customer, inventory loss, transit), location types, and hierarchies.", "confidence": "high"},
    {"id": "cap_stock_moves", "name": "Stock Moves & Pickings", "description": "Create and manage stock.move, stock.picking, stock.picking.type, move lines, states, and reservation logic.", "confidence": "high"},
    {"id": "cap_routes", "name": "Routes & Rules", "description": "Configure stock.route, stock.rule, procurement groups, push/pull rules, and MTS/MTO rules across warehouses.", "confidence": "high"},
    {"id": "cap_reordering", "name": "Reordering Rules", "description": "Manage stock.warehouse.orderpoint (reordering rules), min/max quantities, order quantities, and triggering RFQs/sales orders.", "confidence": "high"},
    {"id": "cap_lots_serial", "name": "Lots & Serial Tracking", "description": "Enable lot/serial tracking, manage stock.lot, expiration dates, removal strategies (FEFO, FIFO, LIFO), and traceability reports.", "confidence": "high"},
    {"id": "cap_valuation", "name": "Inventory Valuation", "description": "Configure stock valuation categories, cost methods, stock_account, automatic inventory valuation, and landed costs (Enterprise).", "confidence": "high"},
    {"id": "cap_mts_mto", "name": "MTS/MTO & Procurement", "description": "Configure Make-to-Stock vs Make-to-Order behavior, procurement rules, supply methods, and cross-dock/transit flows.", "confidence": "high"},
    {"id": "cap_barcode", "name": "Barcode Operations", "description": "Use Enterprise stock_barcode for mobile picking, receiving, transfers, inventory adjustments, and barcode scanning workflows.", "confidence": "medium"}
  ],
  "limitations": [
    "Barcode operations require Enterprise stock_barcode",
    "Landed costs and advanced valuation are Enterprise features",
    "Manufacturing integration requires the mrp module",
    "Lot/serial tracking cannot be changed on products with existing stock moves"
  ],
  "required_tools": ["python", "database_access", "barcode_scanner"],
  "input_schema": {
    "type": "object",
    "properties": {
      "task": {"type": "string"},
      "product_id": {"type": "integer"},
      "warehouse_id": {"type": "integer"},
      "picking_id": {"type": "integer"},
      "location_id": {"type": "integer"},
      "context": {"type": "object"}
    }
  },
  "output_schema": {
    "type": "object",
    "properties": {
      "recommendation": {"type": "string"},
      "code": {"type": "string"},
      "configuration": {"type": "array", "items": {"type": "object"}},
      "explanations": {"type": "array", "items": {"type": "string"}}
    }
  },
  "evaluation": {
    "functional_count": 30,
    "technical_count": 40,
    "architecture_count": 10,
    "debugging_count": 10,
    "migration_count": 5,
    "automation_count": 10,
    "total_count": 105
  },
  "tags": ["inventory", "stock", "warehouse", "product", "picking", "route", "reorder", "lot", "serial", "valuation", "barcode"],
  "metadata": {
    "author": "Odoo AI Knowledge Factory",
    "license": "Odoo Enterprise Compatible",
    "generated_at": "2026-07-17T12:00:00Z",
    "source_count": 35,
    "claim_count": 78,
    "knowledge_graph_nodes": 28,
    "changelog": "v19.0.1 — Initial Inventory skill based on source code analysis of stock, stock_account, purchase_stock, sale_stock, stock_barcode, stock_landed_costs"
  }
}
